bliny-s-myasom-7-sht-43242,"Блины с мясом, 7 шт",509,Готовая еда,https://vkusvill.ru/goods/bliny-s-myasom-7-sht-43242.html,vkusvill_improved,https://vkusvill.ru/local/templates/main-responsive/img/header/menu_slider/catalog.svg,"СМИК ООО: блинчики (вода питьевая, мука пшеничная хлебопекарная в/с, меланж яичный жидкий пастеризованный, масло подсолнечное рафинированное дезодорированное, молоко питьевое пастеризованное м.д.ж. 3,2 %, сахар, соль пищевая), начинк",,490.0г,230.2,10.9,12.2,19.2
salat-tsezar-19363,"Салат ""Цезарь""",328,Готовая еда,https://vkusvill.ru/goods/salat-tsezar-19363.html,vkusvill_improved,https://vkusvill.ru/local/templates/main-responsive/img/header/menu_slider/catalog.svg,"ФЛАЙ СЕРВИС ООО: салат романо свежий, салат айсберг свежий, филе куриное запечённое (филе куриной грудки, сок лимона прямого отжима, перец чёрный молотый, соль пищевая, вода питьевая), томаты черри свежие, сыр пармезан молодой м. д.",,180.0г,207.1,12.2,14.3,7.4
chay-zelenyy-listovoy-klassicheskiy-0-4-kafe-29455,"Чай зеленый листовой классический 0,4, кафе",120,Готовая еда,https://vkusvill.ru/goods/chay-zelenyy-listovoy-klassicheskiy-0-4-kafe-29455.html,vkusvill_improved,https://vkusvill.ru/local/templates/main-responsive/img/header/menu_slider/catalog.svg,"вода питьевая, чай зелёный листовой Green Leaf (чай зеленый рассыпной листовой крупный).",,100.0г,,,,0.3
pirozhki-s-kapustnoy-nachinkoy-160-g-4-sht-75681,"Пирожки с капустной начинкой, 160 г (4 шт)",218,Готовая еда,https://vkusvill.ru/goods/pirozhki-s-kapustnoy-nachinkoy-160-g-4-sht-75681.html,vkusvill_improved,https://vkusvill.ru/local/templates/main-responsive/img/header/menu_slider/catalog.svg,"мука пшеничная хлебопекарная высшего сорта, капуста белокочанная свежая, яйцо куриное пищевое, молоко питьевое ультрапастеризованное м.д.ж. 3,2 %, лук репчатый свежий, масло сладкосливочное несоленое м.д.ж. 82%, меланж яичный жидкий",,160.0г,264,6.6,12.8,30.6
syrniki-tvorozhnye-s-yablochnoy-nachinkoy-64757,Сырники творожные с яблочной начинкой,218,Готовая еда,https://vkusvill.ru/goods/syrniki-tvorozhnye-s-yablochnoy-nachinkoy-64757.html,vkusvill_improved,https://vkusvill.ru/local/templates/main-responsive/img/header/menu_slider/catalog.svg,"сырники (творог м.д.ж 9% (нормализованное пастеризованное молоко, закваска, молокосвертывающий сычужный ферментный препарат животного происхождения), мука пшеничная хлебопекарная высшего сорта, сахар, масло подсолнечное рафинированн",,130.0г,174.3,11.4,5.9,18.9
sup-fo-bo-91332,Суп Фо Бо,328,Готовая еда,https://vkusvill.ru/goods/sup-fo-bo-91332.html,vkusvill_improved,https://vkusvill.ru/local/templates/main-responsive/img/header/menu_slider/catalog.svg,"бульон процеженный (вода питьевая, суповой набор говяжий замороженный, корень имбиря свежий, сахар, кинза свежая, чеснок свежий, соль пищевая, бадьян сушеный, палочки корицы, перец душистый горошек, гвоздика целая, кардамон молотый),",,400.0г,47.6,2.3,1.2,6.9
bolshaya-portsiya-ezhikov-po-domashnemu-v-tomatno-slivochnom-souse-4-sht-113123,"Большая порция ежиков ""по-домашнему"" в томатно - сливочном соусе (4 шт)",590,Готовая еда,https://vkusvill.ru/goods/bolshaya-portsiya-ezhikov-po-domashnemu-v-tomatno-slivochnom-souse-4-sht-113123.html,vkusvill_improved,https://vkusvill.ru/local/templates/main-responsive/img/header/menu_slider/catalog.svg,"Ежики (свинина, лук репчатый свежий, вода питьевая, говядина, крупа рисовая, яйцо куриное пищевое, масло подсолнечное рафинированное дезодорированное, соль пищевая, перец чёрный молотый), соус томатный (томаты консервированные (томат",,420.0г,151,7.7,9.4,8.9
shashlyk-kurinyy-s-sousom-ayoli-98595,Шашлык куриный с соусом айоли,298,Готовая еда,https://vkusvill.ru/goods/shashlyk-kurinyy-s-sousom-ayoli-98595.html,vkusvill_improved,https://vkusvill.ru/local/templates/main-responsive/img/header/menu_slider/catalog.svg,"шашлык куриный (филе куриной грудки охлажденное, майонез м.д.ж. 67% (масло подсолнечное рафинированное дезодорированное, вода питьевая, сахар, яичный желток, соль пищевая, горчичный порошок, кислота уксусная 70%), специи сушеные мол",,200.0г,218.6,19.1,11.4,9.9
nalistniki-konvertiki-s-syrnym-kremom-i-malinovoy-nachinkoy-105834,"Налистники ""Конвертики"" с сырным кремом и малиновой начинкой",228,Готовая еда,https://vkusvill.ru/goods/nalistniki-konvertiki-s-syrnym-kremom-i-malinovoy-nachinkoy-105834.html,vkusvill_improved,https://vkusvill.ru/local/templates/main-responsive/img/header/menu_slider/catalog.svg,"Тесто (молоко питьевое м.д.ж. 3,2%, меланж яичный жидкий пастеризованный, мука пшеничная общего назначения, масло подсолнечное рафинированное дезодорированное, сахар, комплексная пищевая добавка (декстроза, краситель - красный свекол",,140.0г,303.5,7.6,18.7,26.2
pasta-karbonara-25690,"Паста ""Карбонара""",346,Готовая еда,https://vkusvill.ru/goods/pasta-karbonara-25690.html,vkusvill_improved,https://vkusvill.ru/local/templates/main-responsive/img/header/menu_slider/catalog.svg,"макаронные изделия отварные (вода питьевая, макаронные изделия (мука из твердой пшеницы высшего сорта, вода питьевая, меланж яичный сухой), масло подсолнечное рафинированное дезодорированное, соль пищевая), соус (молоко питьевое м.д.",,240.0г,205.7,7.4,9.7,22.2
roll-s-krevetkoy-i-ogurtsom-69875,Ролл с креветкой и огурцом,328,Готовая еда,https://vkusvill.ru/goods/roll-s-krevetkoy-i-ogurtsom-69875.html,vkusvill_improved,https://vkusvill.ru/local/templates/main-responsive/img/header/menu_slider/catalog.svg,"Чем отличается продукт ВкусВилла Низкокалорийное блюдо для ценителей морепродуктов. Состав проверен: нет консервантов, усилителей вкуса и искусственных красителей",,195.0г,121.5,4.5,0.7,24.3
klab-sendvich-s-kuritsey-i-yaytsom-63727,Клаб-сэндвич с курицей и яйцом,228,Готовая еда,https://vkusvill.ru/goods/klab-sendvich-s-kuritsey-i-yaytsom-63727.html,vkusvill_improved,https://vkusvill.ru/local/templates/main-responsive/img/header/menu_slider/catalog.svg,"Изделие хлебобулочное (мука пшеничная хлебопекарная высшего сорта, мука ржаная хлебопекарная обдирная, солод ржаной ферментированный, отруби пшеничные, вода питьевая, масло подсолнечное рафинированное дезодорированное, дрожжи хлебопе",,170.0г,270.3,10.9,14.7,23.6
angliyskiy-zavtrak-53931,Английский завтрак,465,Готовая еда,https://vkusvill.ru/goods/angliyskiy-zavtrak-53931.html,vkusvill_improved,https://vkusvill.ru/local/templates/main-responsive/img/header/menu_slider/catalog.svg,"Картофельная вафля с луком(картофель отварной, молоко коровье пастеризованное м.д.ж. 3,2%, мука пшеничная хлебопекарная высшего сорта, масло сладко-сливочное несоленое м.д.ж. 72,5%, меланж яичный жидкий пастеризованный, лук жареный (",,292.0г,197,8.39,13.4,11.53
file-semgi-na-paru-s-ovoshchnym-garnirom-27193,Филе семги на пару с овощным гарниром,508,Готовая еда,https://vkusvill.ru/goods/file-semgi-na-paru-s-ovoshchnym-garnirom-27193.html,vkusvill_improved,https://vkusvill.ru/local/templates/main-responsive/img/header/menu_slider/catalog.svg,"лосось атлантический (сёмга) (продукт аквакультуры, произведено из мороженого сырья), капуста брокколи быстрозамороженная, капуста цветная быстрозамороженная, морковь столовая свежая, масло подсолнечное рафинированное дезодорированно",,230.0г,96.4,7.9,6.4,1.8
latte-malina-mindal-na-kokosovom-napitke-300-ml-kafe-114071,"Латте малина-миндаль на кокосовом напитке 300 мл, кафе",380,Готовая еда,https://vkusvill.ru/goods/latte-malina-mindal-na-kokosovom-napitke-300-ml-kafe-114071.html,vkusvill_improved,https://vkusvill.ru/local/templates/main-responsive/img/header/menu_slider/catalog.svg,"Напиток на растительной основе Кокосовое специальное, обогащенный кальцием (вода питьевая, рисовая мука, кокосовая паста, масло подсолнечное, регуляторы кислотности (орто-Фосфат калия 2-замещенный, орто-Фосфат натрия 1-замещенный),",,100.0г,57,1.1,1.4,10
chiabatta-s-parmezanom-kuritsey-i-sousom-tsezar-fk-104837,"Чиабатта с пармезаном, курицей и соусом Цезарь ФК",370,Готовая еда,https://vkusvill.ru/goods/chiabatta-s-parmezanom-kuritsey-i-sousom-tsezar-fk-104837.html,vkusvill_improved,https://vkusvill.ru/local/templates/main-responsive/img/header/menu_slider/catalog.svg,"Чиабатта (мука пшеничная хлебопекарная в/с, вода питьевая, масло оливковое нерафинированное, крупа манная, соль пищевая, сахар, дрожжи сухие), филе куриное запеченное (куриная грудка филе (произведено из мороженого сырья), вода пить",,260.0г,210.36,6.68,11.52,19.99
kurinoe-file-zapechennoe-s-kabachkami-65027,Куриное филе запеченное с кабачками,288,Готовая еда,https://vkusvill.ru/goods/kurinoe-file-zapechennoe-s-kabachkami-65027.html,vkusvill_improved,https://vkusvill.ru/local/templates/main-responsive/img/header/menu_slider/catalog.svg,"Филе куриной грудки, кабачок свежий, томаты черри свежие, масло подсолнечное рафинированное дезодорированное, луковый сок (лук репчатый свежий), соль пищевая, перец черный молотый Продукция производится на предприятии, где используют",,200.0г,101.6,13.9,3.6,3.4
oladi-pechenochnye-300-g-69649,"Оладьи печеночные, 300 г",428,Готовая еда,https://vkusvill.ru/goods/oladi-pechenochnye-300-g-69649.html,vkusvill_improved,https://vkusvill.ru/local/templates/main-responsive/img/header/menu_slider/catalog.svg,"Лук репчатый свежий, субпродукты говяжьи (печень) (произведено из мороженого сырья), морковь столовая свежая, мука пшеничная хлебопекарная высшего сорта, масло подсолнечное рафинированное дезодорированное, молоко питьевое ультрапасте",,300.0г,180.6,15.2,7,14.2
shnitsel-kurinyy-v-syrnoy-panirovke-s-makaronami-59037,Шницель куриный в сырной панировке с макаронами,318,Готовая еда,https://vkusvill.ru/goods/shnitsel-kurinyy-v-syrnoy-panirovke-s-makaronami-59037.html,vkusvill_improved,https://vkusvill.ru/local/templates/main-responsive/img/header/menu_slider/catalog.svg,"шницель куриный в сырной панировке (куриное филе грудки, сухари панировочные (мука пшеничная хлебопекарная высшего сорта, вода питьевая, дрожжи хлебопекарные прессованные), масло подсолнечное рафинированное дезодорированное, меланж я",,230.0г,209.6,11.8,10,18.1
poket-chiken-296296,Покет Чикен,245,Готовая еда,https://vkusvill.ru/goods/poket-chiken-296296.html,vkusvill_improved,https://vkusvill.ru/local/templates/main-responsive/img/header/menu_slider/catalog.svg,"хлеб для сэндвича (мука пшеничная высшего сорта, вода питьевая, масло сладко-сливочное несолёное с массовой долей жира 82,5 %, меланж яичный пастеризованный охлаждённый, молоко питьевое массовая доля жира 3,2 %, сахар, дрожжи прессов",,136.0г,247,7.59,12.71,24.34
bliny-s-yablokom-i-koritsey-94841,Блины с яблоком и корицей,224,Готовая еда,https://vkusvill.ru/goods/bliny-s-yablokom-i-koritsey-94841.html,vkusvill_improved,https://vkusvill.ru/local/templates/main-responsive/img/header/menu_slider/catalog.svg,"Мука пшеничная хлебопекарная высшего сорта, молоко м. д. ж. 3,2% (молоко нормализованное), меланж яичный пастеризованный охлажденный жидкий, сахар белый, яблоко быстрозамороженное, масло подсолнечное рафинированное дезодорированное,",,150.0г,260,8,16,21
kofe-raf-popkorn-0-3-na-rastitelnom-napitke-kafe-83396,"Кофе раф ""Попкорн"" 0,3 на растительном напитке, кафе",360,Готовая еда,https://vkusvill.ru/goods/kofe-raf-popkorn-0-3-na-rastitelnom-napitke-kafe-83396.html,vkusvill_improved,https://vkusvill.ru/local/templates/main-responsive/img/header/menu_slider/catalog.svg,"напиток на растительной основе (вода питьевая, масло кокосовое рафинированное, масло подсолнечное рафинированное дезодорированное, рисовая мука, изолят соевого белка, стабилизаторы (орто-Фосфат калия 2-замещенный, цитрат натрия 2-зам",,300.0г,113.8,1.3,7.4,10.5
kombo-losos-steyk-s-kozhey-na-paru-i-salat-iz-svekly-s-chernoslivom-i-gretskimi-orekhami-98449,Комбо: Лосось стейк с кожей на пару и салат из свеклы с черносливом и грецкими орехами,255,Готовая еда,https://vkusvill.ru/goods/kombo-losos-steyk-s-kozhey-na-paru-i-salat-iz-svekly-s-chernoslivom-i-gretskimi-orekhami-98449.html,vkusvill_improved,https://vkusvill.ru/local/templates/main-responsive/img/header/menu_slider/catalog.svg,"Лосось атлантический (сёмга) стейк с кожей (продукция аквакультуры) охлажденный, лимон свежий, соль пищевая. Производится на предприятии, где используется моллюски и ракообразные. Продукт готов к употреблению. Свекла столовая отварна",,345.0г,239.5,24.1,15.9,
kurinye-stripsy-s-firmennym-sousom-337570,Куриные стрипсы с фирменным соусом,293,Готовая еда,https://vkusvill.ru/goods/kurinye-stripsy-s-firmennym-sousom-337570.html,vkusvill_improved,https://vkusvill.ru/local/templates/main-responsive/img/header/menu_slider/catalog.svg,"куриные стрипсы (филе куриное грудки (произведено из замороженного сырья), соус соевый (вода питьевая, соевые бобы, пшеница, соль, сахар), лук сушеный (лук сушеный репчатый резаный), чеснок сушеный гранулированный, приправа тако (суш",,100.0г,313,14.23,24.81,7.9
sosiska-v-sloenom-teste-s-syrom-i-gorchitsey-68814,Сосиска в слоеном тесте с сыром и горчицей,186,Готовая еда,https://vkusvill.ru/goods/sosiska-v-sloenom-teste-s-syrom-i-gorchitsey-68814.html,vkusvill_improved,https://vkusvill.ru/local/templates/main-responsive/img/header/menu_slider/catalog.svg,"тесто слоеное (мука пшеничная хлебопекарная высшего сорта, масло сладко-сливочное несоленое м.д.ж. 82.5%, молоко пастеризованное м.д.ж. 3.2%, меланж яичный пастеризованный, сахар, дрожжи хлебопекарные сухие, соль пищевая), колбасное",,105.0г,327,8.3,25.8,15.4
kartofel-zharenyy-s-gribami-ves-98524,"Картофель жареный с грибами, вес.",700,Готовая еда,https://vkusvill.ru/goods/kartofel-zharenyy-s-gribami-ves-98524.html,vkusvill_improved,https://vkusvill.ru/local/templates/main-responsive/img/header/menu_slider/catalog.svg,"Картофель свежий, грибы шампиньоны свежие, грибы белые замороженные, масло подсолнечное рафинированное дезодорированное, лук зеленый свежий, соль пищевая Продукция производится на предприятии, где используются аллергены: арахис, горч",,100.0г,219,4.1,13.8,19.6
sibas-tushka-v-marinade-na-grile-sht-90820,"Сибас тушка в маринаде на гриле, шт",645,Готовая еда,https://vkusvill.ru/goods/sibas-tushka-v-marinade-na-grile-sht-90820.html,vkusvill_improved,https://vkusvill.ru/local/templates/main-responsive/img/header/menu_slider/catalog.svg,"Сибас (продукция аквакультуры) охлажденный, лимон свежий, масло подсолнечное рафинированное дезодорированное, специи (кориандр молотый, паприка красная молотая, морковь сушеная, зелень укропа сушеная, куркума молотая, лук репчатый, с",,300.0г,105.5,21.2,2.3,
sup-gorokhovyy-s-kopchyenostyami-1kg-72947,"Суп ""Гороховый"" с копчёностями, 1кг",518,Готовая еда,https://vkusvill.ru/goods/sup-gorokhovyy-s-kopchyenostyami-1kg-72947.html,vkusvill_improved,https://vkusvill.ru/local/templates/main-responsive/img/header/menu_slider/catalog.svg,"ГЛОБАЛ ФУД ООО: вода питьевая, картофель свежий, бульон говяжий процеженный (вода питьевая, говядина (произведено из замороженного сырья), лук репчатый свежий, морковь столовая свежая, перец черный горошком дробленный, петрушка свежа",,100.0г,89.7,3.4,6.5,4.4
shaurma-s-pechenymi-veshenkami-i-kartofelem-89766,Шаурма с печеными вешенками и картофелем,228,Готовая еда,https://vkusvill.ru/goods/shaurma-s-pechenymi-veshenkami-i-kartofelem-89766.html,vkusvill_improved,https://vkusvill.ru/local/templates/main-responsive/img/header/menu_slider/catalog.svg,"Лаваш (мука пшеничная хлебопекарная высшего сорта, вода питьевая, соль пищевая), картофель свежий, грибы вешенки свежие, грибы шампиньоны свежие, масло подсолнечное рафинированное дезодорированное, капуста белокочанная свежая, лук кр",,210.0г,270.4,5,16.4,25.7
kartofel-zapechennyy-s-provanskimi-travami-70125,Картофель запеченный с прованскими травами,244,Готовая еда,https://vkusvill.ru/goods/kartofel-zapechennyy-s-provanskimi-travami-70125.html,vkusvill_improved,https://vkusvill.ru/local/templates/main-responsive/img/header/menu_slider/catalog.svg,"картофель свежий, масло оливковое нерафинированное, чесночное масло (масло подсолнечное рафинированное дезодорированное, чеснок свежий), соль пищевая, тимьян свежий, розмарин свежий Продукция производится на предприятии, где использу",,250.0г,141,3.6,3.4,24
kutaby-s-syrom-tvorogom-i-zelenyu-48257,"Кутабы с сыром, творогом и зеленью",227,Готовая еда,https://vkusvill.ru/goods/kutaby-s-syrom-tvorogom-i-zelenyu-48257.html,vkusvill_improved,https://vkusvill.ru/local/templates/main-responsive/img/header/menu_slider/catalog.svg,"мука пшеничная хлебопекарная высшего сорта, сыр моцарелла м.д.ж. в сухом веществе 45 % (молоко нормализованное пастеризованное, термофильная молочнокислая закваска, молокосвёртывающий фермент животного происхождения, соль пищевая), т",,165.0г,240.7,11.2,11.9,22.2
kofe-raf-syrnyy-300-ml-kafe-114077,"Кофе раф сырный 300 мл, кафе",360,Готовая еда,https://vkusvill.ru/goods/kofe-raf-syrnyy-300-ml-kafe-114077.html,vkusvill_improved,https://vkusvill.ru/local/templates/main-responsive/img/header/menu_slider/catalog.svg,"Сливки питьевые ультрапастеризованные м. д. ж. 10% (сливки нормализованные), вода питьевая, сироп Сырный (сахар, вода питьевая, комплексная пищевая добавка (носитель  мальтодекстрин, порошок сырный сухой (профиль Гауда), экстрак",,100.0г,112,2.8,8,7.2
chay-s-soboy-marokkanskiy-0-3-kafe-102151,"Чай с собой Марокканский 0.3, кафе",180,Готовая еда,https://vkusvill.ru/goods/chay-s-soboy-marokkanskiy-0-3-kafe-102151.html,vkusvill_improved,https://vkusvill.ru/local/templates/main-responsive/img/header/menu_slider/catalog.svg,"вода питьевая, апельсин свежий, чай черный Марокканский (красный байховый чай, сублимированный апельсин, гвоздика, корица, мята), мята свежая.",,,,,,
kurinaya-nozhka-kentukki-s-kartofelnymi-dolkami-113002,"Куриная ножка ""Кентукки"" с картофельными дольками",338,Готовая еда,https://vkusvill.ru/goods/kurinaya-nozhka-kentukki-s-kartofelnymi-dolkami-113002.html,vkusvill_improved,https://vkusvill.ru/local/templates/main-responsive/img/header/menu_slider/catalog.svg,"Куриная ножка (голень куриная на кости , масло подсолнечное рафинированное дезодорированное, сухари панировочные (мука пшеничная хлебопекарная высшего сорта, соль пищевая, дрожжи хлебопекарные), мука пшеничная хлебопекарная высшего",,200.0г,320.3,16.8,17.9,23
