mayami-roll-379129,Майами ролл,585,Готовая еда,https://vkusvill.ru/goods/mayami-roll-379129.html,vkusvill_improved,https://vkusvill.ru/local/templates/main-responsive/img/header/menu_slider/catalog.svg,"основа (водоросли Нори сушеные, рис (крупа рисовая отварная (вода питьевая, крупа рисовая шлифованная, соус для риса (уксус рисовый (уксус рисовый, уксус спиртовой, вода питьевая, сахар, соль пищевая), сахар, соль пищевая)), сыр твор",,234.0г,215,2.59,9.26,29.97
kombo-dorado-na-paru-i-salat-iz-svekly-s-chernoslivom-i-gretskimi-orekhami-95382,Комбо: Дорадо на пару и салат из свеклы с черносливом и грецкими орехами,599,Готовая еда,https://vkusvill.ru/goods/kombo-dorado-na-paru-i-salat-iz-svekly-s-chernoslivom-i-gretskimi-orekhami-95382.html,vkusvill_improved,https://vkusvill.ru/local/templates/main-responsive/img/header/menu_slider/catalog.svg,"Дорадо охлажденная, лимон свежий, соль пищевая. Производится на предприятии, где используются моллюски, ракообразные. Продукт готов к употреблению Продукт производится на предприятии, где используются моллюски, ракообразные. Продукт",,450.0г,,,,
file-kambaly-zharenoe-so-struchkovoy-fasolyu-112977,Филе камбалы жареное со стручковой фасолью,368,Готовая еда,https://vkusvill.ru/goods/file-kambaly-zharenoe-so-struchkovoy-fasolyu-112977.html,vkusvill_improved,https://vkusvill.ru/local/templates/main-responsive/img/header/menu_slider/catalog.svg,"Филе камбалы морской с кожей замороженное, фасоль стручковая замороженная, масло подсолнечное рафинированное дезодорированное, масло сливочное м.д.ж 82,5% (сливки пастеризованные), семена кунжута, мука пшеничная хлебопекарная высшего",,200.0г,117.4,8.4,7,5.2
set-zapechennyy-vulkan-379134,Сет Запеченный вулкан,690,Готовая еда,https://vkusvill.ru/goods/set-zapechennyy-vulkan-379134.html,vkusvill_improved,https://vkusvill.ru/local/templates/main-responsive/img/header/menu_slider/catalog.svg,"рис отварной (крупа рисовая, вода, соус рисовый (уксус рисовый (вода, рисовый уксус, уксусная кислота, сахар, соль), сахар, соль), фарш спайс: жареное филе угря в соусе проложенное (угорь речной (продукция аквакультуры, произведено и",,240.0г,242,3.09,14.06,26.08
chay-latte-karakchay-0-3-na-bananovom-napitke-kafe-107922,"Чай латте ""Каракчай"" 0.3 на банановом напитке, кафе",350,Готовая еда,https://vkusvill.ru/goods/chay-latte-karakchay-0-3-na-bananovom-napitke-kafe-107922.html,vkusvill_improved,https://vkusvill.ru/local/templates/main-responsive/img/header/menu_slider/catalog.svg,"Напиток на растительной основе Соевое банановое специальное (вода питьевая, сахар, соевая мука, рисовая мука, масло подсолнечное, регулятор кислотности - орто-Фосфат калия 2-замещенный, ароматизаторы натуральные, соль морская пищев",,,,,,
kombo-nabor-bitochki-sochnye-s-penne-i-salat-krabovyy-102212,"Комбо-набор: Биточки сочные с пенне и Салат ""Крабовый""",360,Готовая еда,https://vkusvill.ru/goods/kombo-nabor-bitochki-sochnye-s-penne-i-salat-krabovyy-102212.html,vkusvill_improved,https://vkusvill.ru/local/templates/main-responsive/img/header/menu_slider/catalog.svg,"макаронные изделия отварные (вода питьевая, макаронные изделия из твердых сортов пшеницы (мука из твердой пшеницы высшего сорта, вода питьевая), масло подсолнечное рафинированное дезодорированное, соль пищевая), биточки жареные (сви",,360.0г,194.3,10.2,6.7,23.3
kakao-pryanoe-0-3-kafe-29441,"Какао пряное 0,3, кафе",200,Готовая еда,https://vkusvill.ru/goods/kakao-pryanoe-0-3-kafe-29441.html,vkusvill_improved,https://vkusvill.ru/local/templates/main-responsive/img/header/menu_slider/catalog.svg,"молоко ультрапастеризованное м.д.ж. 3,2% (молоко цельное, молоко обезжиренное), какао-порошок Мексиканский (какао-порошок с пониженным содержанием жира, сахар тростниковый нерафинированный, корица молотая, перец красный молотый).",,100.0г,73.7,3.4,3.3,7.6
roll-simfoniya-klassiki-s-krevetkoy-50389,"Ролл ""Симфония классики"" с креветкой",368,Готовая еда,https://vkusvill.ru/goods/roll-simfoniya-klassiki-s-krevetkoy-50389.html,vkusvill_improved,https://vkusvill.ru/local/templates/main-responsive/img/header/menu_slider/catalog.svg,"рис отварной (крупа рисовая шлифованная, вода питьевая, соус рисовый (уксус рисовый 4,3 % (вода питьевая, уксус рисовый, кислота уксусная, сахар, соль пищевая), сахар, соль пищевая)), креветка в сухарях (креветка белоногая Litopenaeu",,180.0г,211.3,5.5,10.5,23.7
borshch-s-govyadinoy-300-gramm-97098,"Борщ с говядиной, 300 грамм",178,Готовая еда,https://vkusvill.ru/goods/borshch-s-govyadinoy-300-gramm-97098.html,vkusvill_improved,https://vkusvill.ru/local/templates/main-responsive/img/header/menu_slider/catalog.svg,"бульон говяжий процеженный (вода питьевая, говядина (произведено из охлажденного сырья), соль пищевая, лук репчатый свежий, морковь столовая свежая, корень сельдерея свежий, чеснок свежий), заправка (свёкла столовая свежая, томатная",,300.0г,64.1,3.9,3.3,4.7
bitochek-kurinyy-s-kapustoy-i-kartofelnym-pyure-71215,Биточек куриный с капустой и картофельным пюре,228,Готовая еда,https://vkusvill.ru/goods/bitochek-kurinyy-s-kapustoy-i-kartofelnym-pyure-71215.html,vkusvill_improved,https://vkusvill.ru/local/templates/main-responsive/img/header/menu_slider/catalog.svg,"Корона Фуд ООО: картофельное пюре (картофель свежий, молоко питьевое пастеризованное м.д.ж. 3,2% (молоко цельное, молоко обезжиренное), масло сладко-сливочное несоленое м.д.ж. 82,5 % (сливки пастеризованные), соль пищевая), биточек к",,200.0г,144,5,8,13
kish-syr-s-ovoshchami-28728,"Киш ""Сыр с овощами""",236,Готовая еда,https://vkusvill.ru/goods/kish-syr-s-ovoshchami-28728.html,vkusvill_improved,https://vkusvill.ru/local/templates/main-responsive/img/header/menu_slider/catalog.svg,"мука пшеничная хлебопекарная высшего сорта, яйцо куриное пищевое, сыр м. д. ж. в сухом веществе 45% (молоко обезжиренное пастеризованное, сливки пастеризованные, соль пищевая, закваска мезофильных молочнокислых микроорганизмов, молок",,160.0г,265.5,11.1,15.9,19.5
sosiska-v-teste-kafe-93804,"Сосиска в тесте, кафе",156,Готовая еда,https://vkusvill.ru/goods/sosiska-v-teste-kafe-93804.html,vkusvill_improved,https://vkusvill.ru/local/templates/main-responsive/img/header/menu_slider/catalog.svg,"Самый популярный школьный перекус с правильным составом Ничего лишнего: только мягкая дрожжевая булочка с кунжутной посыпкой и сочная подкопчённая сосиска из свинины и говядины. То, что нужно для быстрого мобильного перекуса.",,100.0г,306.8,11.5,16.8,27.4
syrniki-tvorozhnye-260-g-64201,"Сырники творожные, 260 г",236,Готовая еда,https://vkusvill.ru/goods/syrniki-tvorozhnye-260-g-64201.html,vkusvill_improved,https://vkusvill.ru/local/templates/main-responsive/img/header/menu_slider/catalog.svg,"Чем отличается продукт ВкусВилла Простой и понятный состав без ароматизаторов, усилителей вкуса и консервантов",,260.0г,183.6,14.7,4,22.2
pasta-s-kuritsey-i-gribami-khalyal-91818,Паста с курицей и грибами Халяль,297,Готовая еда,https://vkusvill.ru/goods/pasta-s-kuritsey-i-gribami-khalyal-91818.html,vkusvill_improved,https://vkusvill.ru/local/templates/main-responsive/img/header/menu_slider/catalog.svg,"макаронные изделия отварные (вода питьевая, макаронные изделия (мука из твердой пшеницы высшего сорта, вода питьевая), масло подсолнечное рафинированное дезодорированное), мясо цыплят-бройлеров замороженное, сливки питьевые м. д. ж.",,250.0г,164.2,6.3,11,10
onigiri-krabovyy-v-souse-spaysi-85210,"Онигири ""Крабовый"" в соусе ""Спайси""",218,Готовая еда,https://vkusvill.ru/goods/onigiri-krabovyy-v-souse-spaysi-85210.html,vkusvill_improved,https://vkusvill.ru/local/templates/main-responsive/img/header/menu_slider/catalog.svg,"Крупа рисовая заправленная (вода питьевая, крупа рисовая, заправка (уксус рисовый 3% (рисовый уксус (вода питьевая, крупа рисовая), регулятор кислотности - кислота уксусная ледяная)), сахар, соль пищевая, масло рисовое нерафинирован",,120.0г,232.6,3.8,7.4,37.7
shashlychok-iz-bedra-tsyplenka-broylera-s-paprikoy-93525,Шашлычок из бедра цыпленка-бройлера с паприкой,340,Готовая еда,https://vkusvill.ru/goods/shashlychok-iz-bedra-tsyplenka-broylera-s-paprikoy-93525.html,vkusvill_improved,https://vkusvill.ru/local/templates/main-responsive/img/header/menu_slider/catalog.svg,"филе бедра цыпленка-бройлера, масло подсолнечное рафинирование, соль пищевая, паприка молотая, перец чили красный молотый, горчичный порошок, чеснок сушеный молотый Продукция производится на предприятии, где используются аллергены:",,200.0г,195.4,15.6,14.2,1.3
shanezhka-severnaya-s-kartofelem-i-syrom-kafe-109598,"Шанежка ""Северная"" с картофелем и сыром, кафе",150,Готовая еда,https://vkusvill.ru/goods/shanezhka-severnaya-s-kartofelem-i-syrom-kafe-109598.html,vkusvill_improved,https://vkusvill.ru/local/templates/main-responsive/img/header/menu_slider/catalog.svg,"Открытый пирожок с сытной начинкой  традиционная северная выпечка с характерным ароматом. Тесто на кефире с добавлением сливочного масла получается плотным, но остаётся нежным внутри. Полутвёрдый сыр при запекании образует аппетитные тягучие нити, но не перебивает вкус картофеля. Булочка хороша и тёплой, когда сыр особенно пластичный, и остывшей  тогда лучше чувствуется вкус ржаной основы. Шанежка станет полноценным перекусом или дополнением к душистому чаю. Простой состав из натуральных ингре",,110.0г,261.8,6.1,13,30.1
ragu-ovoshchnoe-ves-sp-108350,"Рагу овощное, вес СП",880,Готовая еда,https://vkusvill.ru/goods/ragu-ovoshchnoe-ves-sp-108350.html,vkusvill_improved,https://vkusvill.ru/local/templates/main-responsive/img/header/menu_slider/catalog.svg,"Картофель свежий, морковь свежая, кабачок свежий, томаты красные свежие, перец красный сладкий свежий, лук репчатый свежий, чеснок свежий, паста томатная (томаты свежие), масло подсолнечное рафинированное (масло подсолнечное рафинир",,100.0г,83.29,2.2,2.41,13.2
sushi-sendvich-fila-331728,Суши-сэндвич Фила,362,Готовая еда,https://vkusvill.ru/goods/sushi-sendvich-fila-331728.html,vkusvill_improved,https://vkusvill.ru/local/templates/main-responsive/img/header/menu_slider/catalog.svg,"крупа рисовая отварная (вода питьевая, крупа рисовая шлифованная, соус для риса (уксус рисовый (уксус рисовый, уксус спиртовой, вода питьевая, сахар, соль пищевая), сахар, соль пищевая), сёмга слабосолёная (филе лосося атлантического",,160.0г,168,4.85,3.78,28.19
file-mintaya-zharenoe-v-klyare-s-kartofelnym-pyure-98614,Филе минтая жареное в кляре с картофельным пюре,268,Готовая еда,https://vkusvill.ru/goods/file-mintaya-zharenoe-v-klyare-s-kartofelnym-pyure-98614.html,vkusvill_improved,https://vkusvill.ru/local/templates/main-responsive/img/header/menu_slider/catalog.svg,"Картофельное пюре (картофель свежий, молоко питьевое пастеризованное м.д.ж. 3,2%, масло сладко-сливочное несоленое м.д.ж. 82,5%, соль пищевая), филе минтая в кляре (филе минтая без кожи без кости (произведено из мороженого сырья), ме",,210.0г,197,6.9,12.2,14.9
ris-s-ezhikami-po-domashnemu-v-tomatno-slivochnom-souse-112905,"Рис с ежиками ""по-домашнему"" в томатно-сливочном соусе",435,Готовая еда,https://vkusvill.ru/goods/ris-s-ezhikami-po-domashnemu-v-tomatno-slivochnom-souse-112905.html,vkusvill_improved,https://vkusvill.ru/local/templates/main-responsive/img/header/menu_slider/catalog.svg,"Ежики ((свинина, лук репчатый свежий, вода питьевая, говядина, крупа рисовая, яйцо куриное пищевое, масло подсолнечное рафинированное дезодорированное, соль пищевая, перец чёрный молотый), соус томатный (томаты консервированные (тома",,350.0г,175.72,6.18,7.24,21.46
bolshaya-portsiya-postnykh-blinchikov-s-kartofelem-i-gribami-380-g-108699,"Большая порция постных блинчиков с картофелем и грибами, 380 г",330,Готовая еда,https://vkusvill.ru/goods/bolshaya-portsiya-postnykh-blinchikov-s-kartofelem-i-gribami-380-g-108699.html,vkusvill_improved,https://vkusvill.ru/local/templates/main-responsive/img/header/menu_slider/catalog.svg,"Блинчики с картофелем и грибами (блины (мука пшеничная хлебопекарная высшего сорта, вода питьевая, масло подсолнечное рафинированное дезодорированное, сахар, соль пищевая), начинка (картофель свежий, грибы шампиньоны свежие, лук репч",,380.0г,194.49,3.47,10.33,21.91
salat-stolichnyy-300-g-89206,"Салат ""Столичный"", 300 г",328,Готовая еда,https://vkusvill.ru/goods/salat-stolichnyy-300-g-89206.html,vkusvill_improved,https://vkusvill.ru/local/templates/main-responsive/img/header/menu_slider/catalog.svg,"Картофель отварной, майонез м.д.ж. 67% (масло подсолнечное рафинированное дезодорированное, вода питьевая, сахар, яичный желток жидкий, соль пищевая, уксус спиртовой 20%, масло горчичное нерафинированное), филе куриной грудки отварно",,300.0г,236.3,8.2,14.3,18.7
kofe-raf-0-4-bez-dobavok-na-rastitelnom-napitke-kafe-95036,"Кофе Раф 0,4 (без добавок) на растительном напитке, кафе",400,Готовая еда,https://vkusvill.ru/goods/kofe-raf-0-4-bez-dobavok-na-rastitelnom-napitke-kafe-95036.html,vkusvill_improved,https://vkusvill.ru/local/templates/main-responsive/img/header/menu_slider/catalog.svg,"напиток на растительной основе (вода питьевая, масло кокосовое рафинированное, масло подсолнечное рафинированное дезодорированное, рисовая мука, изолят соевого белка, стабилизаторы (орто-Фосфат калия 2-замещенный, цитрат натрия 2-зам",,100.0г,109.7,1.8,9.7,3.8
pitstseta-s-vetchinoy-i-syrom-110281,Пиццета с ветчиной и сыром,198,Готовая еда,https://vkusvill.ru/goods/pitstseta-s-vetchinoy-i-syrom-110281.html,vkusvill_improved,https://vkusvill.ru/local/templates/main-responsive/img/header/menu_slider/catalog.svg,"мука пшеничная хлебопекарная высшего сорта, вода питьевая, ветчина куриная варёная (филе грудки (мясо цыплят-бройлеров), окорочок бескостный без кожи (полуфабрикат из мяса цыплят-бройлеров кусковой, бескостный), вода питьевая, пищева",,120.0г,294.9,13.7,12.9,31
sendvich-s-kuritsey-i-pechenym-pertsem-kafe-68303,"Сэндвич с курицей и печеным перцем, кафе",248,Готовая еда,https://vkusvill.ru/goods/sendvich-s-kuritsey-i-pechenym-pertsem-kafe-68303.html,vkusvill_improved,https://vkusvill.ru/local/templates/main-responsive/img/header/menu_slider/catalog.svg,"Хлеб солодовый (мука пшеничная хлебопекарная высшего сорта, ржаная мука, вода питьевая, дрожжи хлебопекарные прессованные, семена льна, семена подсолнечника, картофельные хлопья, соль пищевая, сахар, ржаной солод, масло подсолнечное",,200.0г,243.8,9.9,5.8,38
kakao-pryanoe-0-4-na-kokosovom-napitke-kafe-95132,"Какао пряное 0,4 на кокосовом напитке, кафе",320,Готовая еда,https://vkusvill.ru/goods/kakao-pryanoe-0-4-na-kokosovom-napitke-kafe-95132.html,vkusvill_improved,https://vkusvill.ru/local/templates/main-responsive/img/header/menu_slider/catalog.svg,"напиток на растительной основе рисово-кокосовый (вода питьевая, рисовая мука, кокосовая паста, масло подсолнечное рафинированное дезодорированное, регуляторы кислотности (орто-Фосфат калия 2-замещенный, орто-Фосфат натрия 1-замещенны",,400.0г,,,,
sup-gorokhovyy-s-kopchyenostyami-16417,"Суп ""Гороховый"" с копчёностями",246,Готовая еда,https://vkusvill.ru/goods/sup-gorokhovyy-s-kopchyenostyami-16417.html,vkusvill_improved,https://vkusvill.ru/local/templates/main-responsive/img/header/menu_slider/catalog.svg,"ЭКОФУД ООО: бульон куриный фильтрованный, вода питьевая (для замачивания гороха), картофель свежий, овощи пассерованные (морковь столовая свежая, лук репчатый свежий, масло подсолнечное рафинированное дезодорированное), окорок варёно",,390.0г,89.7,3.4,6.5,4.4
blinchiki-s-tvorogom-44766,Блинчики с творогом,240,Готовая еда,https://vkusvill.ru/goods/blinchiki-s-tvorogom-44766.html,vkusvill_improved,https://vkusvill.ru/local/templates/main-responsive/img/header/menu_slider/catalog.svg,"тесто (молоко коровье цельное питьевое, вода питьевая, мука пшеничная хлебопекарная высшего сорта, яйцо куриное пищевое, сахар, масло подсолнечное рафинированное дезодорированное, соль пищевая). Начинка ( творог натуральный 9%, сахар",,190.0г,166.6,11,3.4,23
barkhatnyy-kofe-na-kokosovom-napitke-kafe-111274,"Бархатный кофе на кокосовом напитке, кафе",240,Готовая еда,https://vkusvill.ru/goods/barkhatnyy-kofe-na-kokosovom-napitke-kafe-111274.html,vkusvill_improved,https://vkusvill.ru/local/templates/main-responsive/img/header/menu_slider/catalog.svg,"напиток на растительной основе Кокосовое специальное, обогащенный кальцием (вода питьевая, рисовая мука, кокосовая паста, масло подсолнечное, регуляторы кислотности (орто-Фосфат калия 2-замещенный, орто-Фосфат натрия 1-замещенный),",,100.0г,48.4,2,2.4,4.7
pirozhok-postnyy-s-yablokom-100g-kafe-84974,"Пирожок (постный) с яблоком 100г, кафе",90,Готовая еда,https://vkusvill.ru/goods/pirozhok-postnyy-s-yablokom-100g-kafe-84974.html,vkusvill_improved,https://vkusvill.ru/local/templates/main-responsive/img/header/menu_slider/catalog.svg,"Тесто (мука пшеничная хлебопекарная высшего сорта, вода питьевая, масло подсолнечное рафинированное дезодорированное, дрожжи хлебопекарные прессованные, сахар, соль пищевая), начинка (яблоки свежие, сахар, крахмал картофельный).",,100.0г,217.6,4.3,2.8,43.8
chebureki-s-myasom-240-g-72683,"Чебуреки с мясом, 240 г",414,Готовая еда,https://vkusvill.ru/goods/chebureki-s-myasom-240-g-72683.html,vkusvill_improved,https://vkusvill.ru/local/templates/main-responsive/img/header/menu_slider/catalog.svg,"начинка (лук репчатый свежий, филе куриной грудки (произведено из замороженного сырья), жир-сырец говяжий (произведено из замороженного сырья), говядина (произведено из замороженного сырья), вода питьевая, соль пищевая, перец чёрный",,240.0г,275.7,9.3,16.5,22.5
kish-s-kuritsey-i-gribami-kafe-27158,"Киш с курицей и грибами, кафе",262,Готовая еда,https://vkusvill.ru/goods/kish-s-kuritsey-i-gribami-kafe-27158.html,vkusvill_improved,https://vkusvill.ru/local/templates/main-responsive/img/header/menu_slider/catalog.svg,"мука пшеничная хлебопекарная высшего сорта, филе куриной грудки охлажденное, меланж яичный пастеризованный, сыр м.д.ж. в сухом веществе 45% (молоко обезжиренное пастеризованное, сливки пастеризованные, соль пищевая, закваска мезофиль",,160.0г,273.3,12.5,16.9,17.8
