kruassan-s-vetchinoy-kurinoy-i-syrom-66567,Круассан с ветчиной куриной и сыром,312,Готовая еда,https://vkusvill.ru/goods/kruassan-s-vetchinoy-kurinoy-i-syrom-66567.html,vkusvill_improved,https://vkusvill.ru/local/templates/main-responsive/img/header/menu_slider/catalog.svg,"Круассан (мука пшеничная хлебопекарная высшего сорта, молоко массовая доля жира 3,2 %, масло сладкосливочное несолёное массовая доля жира 82,5 %, сахар, дрожжи прессованные, соль пищевая, меланж яичный), сыр Голландский массовая до",,170.0г,332,12.91,20.19,24.86
lepeshki-kartofelnye-s-gaudoy-i-parmezanom-101898,Лепешки картофельные с гаудой и пармезаном,256,Готовая еда,https://vkusvill.ru/goods/lepeshki-kartofelnye-s-gaudoy-i-parmezanom-101898.html,vkusvill_improved,https://vkusvill.ru/local/templates/main-responsive/img/header/menu_slider/catalog.svg,"Картофель свежий, мука пшеничная общего назначения, сыр гауда м.д.ж. в сухом веществе 45% (пастеризованное молоко, соль пищевая, мезофильные молочнокислые микроорганизмы, молокосвертывающий ферментный препарат животного происхождения",,150.0г,279.4,11.2,12.6,30.3
pashtet-iz-chechevitsy-24824,Паштет из чечевицы,182,Готовая еда,https://vkusvill.ru/goods/pashtet-iz-chechevitsy-24824.html,vkusvill_improved,https://vkusvill.ru/local/templates/main-responsive/img/header/menu_slider/catalog.svg,"ООО ВОСТРЯКОВО-2:Чечевица зеленая вареная, масло подсолнечное рафинированное дезодорированное, лук пассерованный, ядра грецких орехов очищенные, томаты сушеные, соль пищевая, перец черный молотый, чеснок сушеный, базилик сушеный, сок лимонный концентрированный. ",,160.0г,310,7.6,30,19.3
galeta-s-ovoshchami-i-sousom-pesto-kafe-109719,"Галета с овощами и соусом песто, кафе",248,Готовая еда,https://vkusvill.ru/goods/galeta-s-ovoshchami-i-sousom-pesto-kafe-109719.html,vkusvill_improved,https://vkusvill.ru/local/templates/main-responsive/img/header/menu_slider/catalog.svg,"мука пшеничная хлебопекарная высшего сорта, баклажан запеченный (баклажан свежий, масло подсолнечное рафинированное дезодорированное), кабачок свежий, томат свежий, вода питьевая, мука пшеничная цельнозерновая, соус песто (базилик зе",,170.0г,195.6,3.8,9.6,23.5
salat-fish-end-vegs-s-treskoy-v-nabore-s-sousom-tar-tar-111619,"Салат ""Фиш энд вегс"" с треской в наборе с соусом тар-тар",398,Готовая еда,https://vkusvill.ru/goods/salat-fish-end-vegs-s-treskoy-v-nabore-s-sousom-tar-tar-111619.html,vkusvill_improved,https://vkusvill.ru/local/templates/main-responsive/img/header/menu_slider/catalog.svg,"треска в панировке (филе трески атлантической (произведено из мороженного сырья), масло подсолнечное рафинированное дезодорированное, молоко питьевое м.д.ж. 3,2%, мука пшеничная хлебопекарная высшего сорта, меланж яичный жидкий пасте",,185.0г,202.1,6.2,15.7,9
pelmeni-otvarnye-s-kuritsey-68684,Пельмени отварные с курицей,248,Готовая еда,https://vkusvill.ru/goods/pelmeni-otvarnye-s-kuritsey-68684.html,vkusvill_improved,https://vkusvill.ru/local/templates/main-responsive/img/header/menu_slider/catalog.svg,"Тесто (мука пшеничная хлебопекарная высшего сорта, вода питьевая, меланж яичный жидкий, соль пищевая), начинка (филе куриного бедра охлажденное, лук репчатый пассерованный (лук репчатый свежий, масло подсолнечное рафинированное дезод",,200.0г,179.4,11.4,6.2,19.5
kapusta-kimchi-okhl-ves-92497,"Капуста кимчи охл., вес",995,Готовая еда,https://vkusvill.ru/goods/kapusta-kimchi-okhl-ves-92497.html,vkusvill_improved,https://vkusvill.ru/local/templates/main-responsive/img/header/menu_slider/catalog.svg,"Капуста пекинская свежая, дайкон свежий, морковь столовая свежая, вода питьевая, лук зеленый свежий, перец чили молотый, лук репчатый свежий, чеснок свежий, яблоко свежее, корень имбиря свежий, экстракт анчоуса, сахар, соль пищевая,",,100.0г,40.6,1.7,0.6,7.1
pirozhok-s-zelenyu-i-yaytsom-kafe-36945,"Пирожок с зеленью и яйцом, кафе",70,Готовая еда,https://vkusvill.ru/goods/pirozhok-s-zelenyu-i-yaytsom-kafe-36945.html,vkusvill_improved,https://vkusvill.ru/local/templates/main-responsive/img/header/menu_slider/catalog.svg,"СТАДИУМ ООО: тесто (мука пшеничная хлебопекарная высшего сорта, молоко питьевое ультрапастеризованное м.д.ж .3,2%(молоко цельное, молоко обезжиренное), масло сливочное м.д.ж. 72,5%(пастеризованные сливки), сахар, соль пищевая, дрожж",,50.0г,247,10.2,10.2,28.6
nalistniki-konvertiki-s-syrnym-kremom-i-vishnyevoy-nachinkoy-106881,"Налистники ""Конвертики"" с сырным кремом и вишнёвой начинкой",228,Готовая еда,https://vkusvill.ru/goods/nalistniki-konvertiki-s-syrnym-kremom-i-vishnyevoy-nachinkoy-106881.html,vkusvill_improved,https://vkusvill.ru/local/templates/main-responsive/img/header/menu_slider/catalog.svg,"Тесто (молоко питьевое м.д.ж. 3,2%, меланж яичный жидкий пастеризованный, мука пшеничная общего назначения, масло подсолнечное рафинированное дезодорированное, сахар, комплексная пищевая добавка (декстроза, краситель - красный свекол",,140.0г,299.8,7.5,18.6,25.6
vulkan-roll-s-krevetkoy-379119,Вулкан-ролл с креветкой,540,Готовая еда,https://vkusvill.ru/goods/vulkan-roll-s-krevetkoy-379119.html,vkusvill_improved,https://vkusvill.ru/local/templates/main-responsive/img/header/menu_slider/catalog.svg,"основа (водоросли Нори сушеные, рис (крупа рисовая отварная (вода питьевая, крупа рисовая шлифованная, соус для риса (уксус рисовый (уксус рисовый, уксус спиртовой, вода питьевая, сахар, соль пищевая), сахар, соль пищевая)), сыр твор",,232.0г,223,3.56,10.57,26.84
salat-s-tuntsom-i-gorchichnym-sousom-95704,Салат с тунцом и горчичным соусом,350,Готовая еда,https://vkusvill.ru/goods/salat-s-tuntsom-i-gorchichnym-sousom-95704.html,vkusvill_improved,https://vkusvill.ru/local/templates/main-responsive/img/header/menu_slider/catalog.svg,"Тунец консервированный (тунец желтоперый, масло подсолнечное рафинированное, соль пищевая), соус горчичный (горчица дижонская (вода, семена горчицы молотые, спиртовой уксус, соль пищевая), уксус бальзамический, масло оливковое нерафи",,200.0г,250,5.3,9.5,3.8
kinoa-otvarnoe-312618,Киноа отварное,163,Готовая еда,https://vkusvill.ru/goods/kinoa-otvarnoe-312618.html,vkusvill_improved,https://vkusvill.ru/local/templates/main-responsive/img/header/menu_slider/catalog.svg,"крупа киноа цельная шлифованная, вода питьевая, соль морская",,120.0г,104.4,4,1.7,18.2
panini-tsezar-na-lyapune-pshenichno-rzhanom-sht-sp-108898,"Панини цезарь на ляпуне пшенично-ржаном, шт СП",290,Готовая еда,https://vkusvill.ru/goods/panini-tsezar-na-lyapune-pshenichno-rzhanom-sht-sp-108898.html,vkusvill_improved,https://vkusvill.ru/local/templates/main-responsive/img/header/menu_slider/catalog.svg,"Ляпун пшенично-ржаной (мука пшеничная хлебопекарная высшего сорта, вода питьевая, мука ржаная хлебопекарная сеяная, солод красный ржаной, заквасочные биокультуры (Propionibacterium freudenreichii subsp. shermanii, Lactobacillus bulga",,140.0г,183.6,8.4,5.4,25.4
nabor-onigiri-onigiri-s-forelyu-i-tvorozhnym-syrom-i-onigiri-s-forelyu-spaysi-112937,Набор Онигири: онигири с форелью и творожным сыром и онигири с форелью спайси,480,Готовая еда,https://vkusvill.ru/goods/nabor-onigiri-onigiri-s-forelyu-i-tvorozhnym-syrom-i-onigiri-s-forelyu-spaysi-112937.html,vkusvill_improved,https://vkusvill.ru/local/templates/main-responsive/img/header/menu_slider/catalog.svg,"Онигири с форелью и творожным сыром: крупа рисовая отварная (крупа рисовая шлифованная, вода питьевая, уксус рисовый 4% (уксус рисовый, уксус спиртовой, вода питьевая, сахар, соль пищевая)), сыр творожный м. д. ж. в сухом веществе 65",,200.0г,,,,
raf-khalva-0-4-kafe-107256,"Раф ""Халва"" 0.4, кафе",380,Готовая еда,https://vkusvill.ru/goods/raf-khalva-0-4-kafe-107256.html,vkusvill_improved,https://vkusvill.ru/local/templates/main-responsive/img/header/menu_slider/catalog.svg,"сливки питьевые ультрапастеризованные м.д.ж. 10% (сливки нормализованные), вода питьевая, халвичная паста (масса подсолнечная (ядра подсолнечника перетёртые обжаренные)), сахар, кофе жареный (арабика, робуста).",,100.0г,140.8,3.7,10.4,8.1
kakao-pryanoe-0-4-na-bezlaktoznom-moloke-kafe-95134,"Какао пряное 0,4 на безлактозном молоке, кафе",320,Готовая еда,https://vkusvill.ru/goods/kakao-pryanoe-0-4-na-bezlaktoznom-moloke-kafe-95134.html,vkusvill_improved,https://vkusvill.ru/local/templates/main-responsive/img/header/menu_slider/catalog.svg,"молоко безлактозное ультрапастеризованное м.д.ж. 1,5% (молоко нормализованное), какао-порошок Мексиканский (какао-порошок с пониженным содержанием жира, нерафинированный тростниковый сахар, корица молотая, красный перец молотый) .",,400.0г,,,,
makarony-s-kuritsey-i-gribami-34804,Макароны с курицей и грибами,248,Готовая еда,https://vkusvill.ru/goods/makarony-s-kuritsey-i-gribami-34804.html,vkusvill_improved,https://vkusvill.ru/local/templates/main-responsive/img/header/menu_slider/catalog.svg,"Макаронные изделия Лингвини группа А высший сорт (мука из твердых сортов пшеницы высшего сорта, вода питьевая), курица (филе бедра курицы, вода питьевая, масло подсолнечное рафинированное дезодорированное, соус соевый (вода питьевая,",,200.0г,171.6,9.2,8.4,14.8
kesadilya-s-vetchinoy-iz-indeyki-i-syrom-83595,Кесадилья с ветчиной из индейки и сыром,338,Готовая еда,https://vkusvill.ru/goods/kesadilya-s-vetchinoy-iz-indeyki-i-syrom-83595.html,vkusvill_improved,https://vkusvill.ru/local/templates/main-responsive/img/header/menu_slider/catalog.svg,"Начинка (соус (томаты свежие, паста томатная массовая доля растворимых сухих веществ 25%, лук репчатый свежий, перец сладкий быстрозамороженный, масло подсолнечное рафинированное дезодорированное, вода питьевая, сахар, уксус столовы",,230.0г,214.5,13.7,8.9,19.9
khachapuri-po-megrelski-5-syrov-81701,"Хачапури по-мегрельски ""5 сыров""",280,Готовая еда,https://vkusvill.ru/goods/khachapuri-po-megrelski-5-syrov-81701.html,vkusvill_improved,https://vkusvill.ru/local/templates/main-responsive/img/header/menu_slider/catalog.svg,"Мука пшеничная хлебопекарная высшего сорта, вода питьевая, сыр Моцарелла м.д.ж. в сухом веществе 45 % (сырный пласт чеддеризированный (молоко нормализованное пастеризованное, соль пищевая, мезофильные и термофильные молочнокислые ми",,250.0г,295.3,14.4,12.9,30.4
barkhatnyy-kofe-na-funduchnom-napitke-kafe-111266,"Бархатный кофе на фундучном напитке, кафе",240,Готовая еда,https://vkusvill.ru/goods/barkhatnyy-kofe-na-funduchnom-napitke-kafe-111266.html,vkusvill_improved,https://vkusvill.ru/local/templates/main-responsive/img/header/menu_slider/catalog.svg,"напиток фундучный на соевой основе ультрапастеризованный (вода питьевая, крупа соевая, сахар, паста ядер орехов фундука обжаренных (ядра орехов фундука обжаренных, ароматизатор натуральный Фундук), регуляторы кислотности (калий фос",,100.0г,41.5,1.5,3.5,1
bliny-s-yablokom-210-g-16942,"Блины с яблоком, 210 г",208,Готовая еда,https://vkusvill.ru/goods/bliny-s-yablokom-210-g-16942.html,vkusvill_improved,https://vkusvill.ru/local/templates/main-responsive/img/header/menu_slider/catalog.svg,"СМИК ООО: блинчики (вода питьевая, мука пшеничная в/с, продукт яичный (меланж), масло подсолнечное рафинированное дезодорированное, сахар, молоко сухое, сыворотка молочная сухая, соль поваренная пищевая), яблоко свежее, сахар, масло",,210.0г,239,5.2,12,32.1
zapekanka-kartofelnaya-s-kuritsey-98213,Запеканка картофельная с курицей,328,Готовая еда,https://vkusvill.ru/goods/zapekanka-kartofelnaya-s-kuritsey-98213.html,vkusvill_improved,https://vkusvill.ru/local/templates/main-responsive/img/header/menu_slider/catalog.svg,"картофель свежий, молоко питьевое м.д.ж. 3,2%, филе грудки куриной охлажденное, сливки питьевые м.д.ж. 33%, масло сладко-сливочное несоленое м.д.ж. 72,5%, масло подсолнечное рафинированное дезодорированное, лук репчатый сушеный, соль",,240.0г,135.3,8.2,6.5,11
parfe-granola-s-golubikoy-klubnikoy-i-yogurtom-53266,"Парфе-гранола с голубикой, клубникой и йогуртом",360,Готовая еда,https://vkusvill.ru/goods/parfe-granola-s-golubikoy-klubnikoy-i-yogurtom-53266.html,vkusvill_improved,https://vkusvill.ru/local/templates/main-responsive/img/header/menu_slider/catalog.svg,"Йогурт греческий массовая доля жира 4% (молоко обезжиренное, молоко цельное с использованием йогуртовой закваски), гранола Тропическая (гранола (цельнозерновые овсяные и пшеничные хлопья, сахар, мука рисовая, мука пшеничная хлебопе",,330.0г,117,6.59,5.26,11.49
pirog-s-yablokami-pekarnya-80125,Пирог с яблоками. Пекарня,255,Готовая еда,https://vkusvill.ru/goods/pirog-s-yablokami-pekarnya-80125.html,vkusvill_improved,https://vkusvill.ru/local/templates/main-responsive/img/header/menu_slider/catalog.svg,"тесто (мука пшеничная хлебопекарная высшего сорта, сахар, молоко питьевое пастеризованное м.д.ж. 3,2%, вода питьевая, яйцо куриное пищевое, масло сливочное м.д.ж. 82,5% (сливки пастеризованные), дрожжи хлебопекарные сухие, соль пищев",,245.0г,188,4,4.8,32.2
pasta-orzo-s-kurinymi-frikadelkami-98052,Паста Орзо с куриными фрикадельками,208,Готовая еда,https://vkusvill.ru/goods/pasta-orzo-s-kurinymi-frikadelkami-98052.html,vkusvill_improved,https://vkusvill.ru/local/templates/main-responsive/img/header/menu_slider/catalog.svg,"Чем отличается продукт ВкусВилла Взяли пасту орзо из твёрдых сортов пшеницы и добавили к ней нежные фрикадельки в ароматном соусе. Проверили состав: нет усилителей вкуса, консервантов и антибиотиков",,220.0г,155.1,6.2,6.7,17.5
sendvich-roll-tsezar-160-gramm-85022,"Сэндвич ролл ""Цезарь"", 160 грамм",238,Готовая еда,https://vkusvill.ru/goods/sendvich-roll-tsezar-160-gramm-85022.html,vkusvill_improved,https://vkusvill.ru/local/templates/main-responsive/img/header/menu_slider/catalog.svg,"Лаваш (мука пшеничная хлебопекарная высший сорт,вода питьевая,соль пищевая), филе куриной грудки су-вид (филе куриной грудки,соль пищевая), томат свежий, салат листовой свежий ,сыр пармезан м.д.ж. в сухом веществе 30% (молоко пастер",,160.0г,239,13,10.6,22.9
baklazhany-po-sychuanski-78244,Баклажаны по-сычуаньски,233,Готовая еда,https://vkusvill.ru/goods/baklazhany-po-sychuanski-78244.html,vkusvill_improved,https://vkusvill.ru/local/templates/main-responsive/img/header/menu_slider/catalog.svg,"Чем отличается продукт ВкусВилла Баклажаны по традиционному китайскому рецепту  с рыбным соусом. Состав проверен: нет искусственных ароматизаторов, консервантов и усилителей вкуса",,150.0г,227.1,1.4,15.9,19.6
kartofel-zapechennyy-s-gribami-94964,Картофель запеченный с грибами,234,Готовая еда,https://vkusvill.ru/goods/kartofel-zapechennyy-s-gribami-94964.html,vkusvill_improved,https://vkusvill.ru/local/templates/main-responsive/img/header/menu_slider/catalog.svg,"Картофель свежий, грибы шампиньоны свежие, лук репчатый свежий, масло подсолнечное дезодорированное, соль поваренная, чеснок гранулированный, паприка сладкая молотая, перец черный молотый. Продукция производится на предприятии, где",,250.0г,135,4,3,23
morkov-po-koreyski-bez-dobavlennogo-sakhara-94833,Морковь по-корейски без добавленного сахара,120,Готовая еда,https://vkusvill.ru/goods/morkov-po-koreyski-bez-dobavlennogo-sakhara-94833.html,vkusvill_improved,https://vkusvill.ru/local/templates/main-responsive/img/header/menu_slider/catalog.svg,"Морковь нарезана тонкой соломкой и заправлена смесью чеснока, кориандра и красного чили. Вкус получается ярким и пряным, в нём острота специй уравновешена лёгкой кислинкой. Масло делает текстуру мягче и связывает все компоненты. А добавленного сахара в составе нет. Такой салат подойдёт к мясу, птице или как самостоятельная закуска.",,275.0г,88,1.5,6,7
pirozhki-sloenye-s-kapustoy-53190,Пирожки слоеные с капустой,210,Готовая еда,https://vkusvill.ru/goods/pirozhki-sloenye-s-kapustoy-53190.html,vkusvill_improved,https://vkusvill.ru/local/templates/main-responsive/img/header/menu_slider/catalog.svg,"Тесто (мука пшеничная хлебопекарная высший сорт, масло сладко-сливочное несоленое массовая доля жира 82,5%, молоко питьевое ультрапастеризованное массовая доля жира 3,2 %, вода питьевая, сахар, яйцо куриное пищевое, дрожжи хлебопека",,120.0г,327.9,6,20.3,30.3
grechnevaya-lapsha-s-indeykoy-41137,Гречневая лапша с индейкой,328,Готовая еда,https://vkusvill.ru/goods/grechnevaya-lapsha-s-indeykoy-41137.html,vkusvill_improved,https://vkusvill.ru/local/templates/main-responsive/img/header/menu_slider/catalog.svg,"лапша гречневая соба отварная (вода питьевая, лапша гречневая соба (мука пшеничная хлебопекарная высшего сорта, мука гречневая высшего сорта, соль пищевая, вода питьевая), масло подсолнечное рафинированное дезодорированное, соль пи",,200.0г,111.4,7.8,4.2,10.6
mini-chiabatta-s-salyami-i-syrom-gauda-2-sht-110744,Мини-чиабатта с салями и сыром Гауда (2 шт),298,Готовая еда,https://vkusvill.ru/goods/mini-chiabatta-s-salyami-i-syrom-gauda-2-sht-110744.html,vkusvill_improved,https://vkusvill.ru/local/templates/main-responsive/img/header/menu_slider/catalog.svg,"Чиабатта (мука пшеничная хлебопекарная высшего сорта, солод ржаной ферментированный, мука ржаная обдирная, смесь специй прованские травы (базилик, лук порей, петрушка, орегано, розмарин, семена укропа, тимьян), масло подсолнечное раф",,250.0г,327.2,10.7,18,30.6
kruassan-s-lososem-i-slivochnym-syrom-66447,Круассан с лососем и сливочным сыром,477,Готовая еда,https://vkusvill.ru/goods/kruassan-s-lososem-i-slivochnym-syrom-66447.html,vkusvill_improved,https://vkusvill.ru/local/templates/main-responsive/img/header/menu_slider/catalog.svg,"Круассан на масле (мука пшеничная хлебопекарная высшего сорта, молоко массовая доля жира 3,2 %, масло сладкосливочное несолёное м. д. ж. 82,5 %, сахар, дрожжи прессованные, соль пищевая, меланж яичный), форель малосоленая ломтики (фо",,210.0г,233,8.07,13.31,20.64
shaurma-s-krevetkoy-sousom-tysyacha-ostrovov-i-salatom-romano-99925,"Шаурма с креветкой, соусом тысяча островов и салатом Романо",358,Готовая еда,https://vkusvill.ru/goods/shaurma-s-krevetkoy-sousom-tysyacha-ostrovov-i-salatom-romano-99925.html,vkusvill_improved,https://vkusvill.ru/local/templates/main-responsive/img/header/menu_slider/catalog.svg,"Лаваш бездрожжевой со свеклой (мука пшеничная высшего сорта, вода питьевая, свекла столовая сушеная, соль пищевая), тигровые креветки запечённые (креветки Litopenaeus vannamei (произведено из мороженого сырья, продукция аквакультур",,200.0г,178.5,6.4,6.1,24.5
